{
  "$schema": "https://json-schema.org/draft/2020-12/schema",
  "$id": "https://outerworld.ai/schema/v1/overseer-status.schema.json",
  "title": "OverseerStatus",
  "type": "object",
  "properties": {
    "schemaVersion": {
      "type": "integer",
      "exclusiveMinimum": 0,
      "maximum": 9007199254740991
    },
    "updatedAt": {
      "type": "string",
      "format": "date-time",
      "pattern": "^(?:(?:\\d\\d[2468][048]|\\d\\d[13579][26]|\\d\\d0[48]|[02468][048]00|[13579][26]00)-02-29|\\d{4}-(?:(?:0[13578]|1[02])-(?:0[1-9]|[12]\\d|3[01])|(?:0[469]|11)-(?:0[1-9]|[12]\\d|30)|(?:02)-(?:0[1-9]|1\\d|2[0-8])))T(?:(?:[01]\\d|2[0-3]):[0-5]\\d:[0-5]\\d(?:\\.\\d+)?(?:Z|([+-](?:[01]\\d|2[0-3]):[0-5]\\d)))$"
    },
    "state": {
      "type": "string",
      "enum": [
        "idle",
        "reconciling",
        "reported",
        "attention"
      ]
    },
    "lastRunStartedAt": {
      "type": "string",
      "format": "date-time",
      "pattern": "^(?:(?:\\d\\d[2468][048]|\\d\\d[13579][26]|\\d\\d0[48]|[02468][048]00|[13579][26]00)-02-29|\\d{4}-(?:(?:0[13578]|1[02])-(?:0[1-9]|[12]\\d|3[01])|(?:0[469]|11)-(?:0[1-9]|[12]\\d|30)|(?:02)-(?:0[1-9]|1\\d|2[0-8])))T(?:(?:[01]\\d|2[0-3]):[0-5]\\d:[0-5]\\d(?:\\.\\d+)?(?:Z|([+-](?:[01]\\d|2[0-3]):[0-5]\\d)))$"
    },
    "lastOutwardPostAt": {
      "type": "string",
      "format": "date-time",
      "pattern": "^(?:(?:\\d\\d[2468][048]|\\d\\d[13579][26]|\\d\\d0[48]|[02468][048]00|[13579][26]00)-02-29|\\d{4}-(?:(?:0[13578]|1[02])-(?:0[1-9]|[12]\\d|3[01])|(?:0[469]|11)-(?:0[1-9]|[12]\\d|30)|(?:02)-(?:0[1-9]|1\\d|2[0-8])))T(?:(?:[01]\\d|2[0-3]):[0-5]\\d:[0-5]\\d(?:\\.\\d+)?(?:Z|([+-](?:[01]\\d|2[0-3]):[0-5]\\d)))$"
    },
    "reconciled": {
      "type": "integer",
      "minimum": 0,
      "maximum": 9007199254740991
    },
    "attention": {
      "type": "array",
      "items": {
        "type": "object",
        "properties": {
          "teamId": {
            "type": "string",
            "pattern": "^[a-z0-9][a-z0-9-]*$"
          },
          "reason": {
            "type": "string"
          }
        },
        "required": [
          "teamId",
          "reason"
        ],
        "additionalProperties": {}
      }
    },
    "digestPath": {
      "type": "string",
      "minLength": 1
    }
  },
  "required": [
    "schemaVersion",
    "updatedAt",
    "state",
    "reconciled",
    "attention",
    "digestPath"
  ],
  "additionalProperties": {}
}
